{
  "schemaVersion": 1,
  "generatedAt": "2026-09-01T08:51:28.239Z",
  "tool": {
    "name": "bfsg-scanner",
    "version": "0.1.0"
  },
  "target": {
    "baseUrl": "https://www.w3.org/WAI/demos/bad/before/",
    "wcagTags": [
      "wcag2a",
      "wcag2aa",
      "wcag21aa"
    ],
    "failOn": "serious"
  },
  "summary": {
    "pagesScanned": 5,
    "pagesFailed": 0,
    "pagesWithViolations": 5,
    "totalViolations": 24,
    "violationsByImpact": {
      "critical": 11,
      "serious": 13,
      "moderate": 0,
      "minor": 0,
      "unknown": 0
    },
    "breachedSuccessCriteria": [
      "1.1.1",
      "1.4.3",
      "2.4.4",
      "3.1.1",
      "4.1.2"
    ],
    "breachedEn301549Clauses": [
      "9.1.1.1",
      "9.1.4.3",
      "9.2.4.4",
      "9.3.1.1",
      "9.4.1.2"
    ]
  },
  "verdict": {
    "violationsAtOrAboveThreshold": 24,
    "unrankedViolations": 0,
    "passed": false
  },
  "pages": [
    {
      "status": "ok",
      "url": "https://www.w3.org/WAI/demos/bad/before/home.html",
      "violations": [
        {
          "ruleId": "color-contrast",
          "tags": [
            "cat.color",
            "wcag2aa",
            "wcag143",
            "TTv5",
            "TT13.c",
            "EN-301-549",
            "EN-9.1.4.3",
            "ACT",
            "RGAAv4",
            "RGAA-3.2.1"
          ],
          "impact": "serious",
          "description": "Ensure the contrast between foreground and background colors meets WCAG 2 AA minimum contrast ratio thresholds",
          "help": "Elements must meet minimum color contrast ratio thresholds",
          "helpUrl": "https://dequeuniversity.com/rules/axe/4.13/color-contrast?application=playwright",
          "nodes": [
            {
              "target": [
                "tr[height=\"25px\"]:nth-child(2) > td[bgcolor=\"#A9B8BF\"][width=\"150px\"] > font[color=\"#41545D\"][size=\"2\"] > b"
              ],
              "html": "<b>Free Penguins</b>",
              "failureSummary": "Fix any of the following:\n  Element has insufficient color contrast of 3.88 (foreground color: #41545d, background color: #a9b8bf, font size: 9.8pt (13px), font weight: bold). Expected contrast ratio of 4.5:1"
            },
            {
              "target": [
                "tr[height=\"25px\"]:nth-child(7) > td[bgcolor=\"#A9B8BF\"][width=\"150px\"] > font[color=\"#41545D\"][size=\"2\"] > b"
              ],
              "html": "<b>More City Parks</b>",
              "failureSummary": "Fix any of the following:\n  Element has insufficient color contrast of 3.88 (foreground color: #41545d, background color: #a9b8bf, font size: 9.8pt (13px), font weight: bold). Expected contrast ratio of 4.5:1"
            }
          ],
          "clauses": {
            "wcagSc": [
              "1.4.3"
            ],
            "en301549": [
              "9.1.4.3"
            ]
          }
        },
        {
          "ruleId": "html-has-lang",
          "tags": [
            "cat.language",
            "wcag2a",
            "wcag311",
            "TTv5",
            "TT11.a",
            "EN-301-549",
            "EN-9.3.1.1",
            "ACT",
            "RGAAv4",
            "RGAA-8.3.1"
          ],
          "impact": "serious",
          "description": "Ensure every HTML document has a lang attribute",
          "help": "<html> element must have a lang attribute",
          "helpUrl": "https://dequeuniversity.com/rules/axe/4.13/html-has-lang?application=playwright",
          "nodes": [
            {
              "target": [
                "html"
              ],
              "html": "<html>",
              "failureSummary": "Fix any of the following:\n  The <html> element does not have a lang attribute"
            }
          ],
          "clauses": {
            "wcagSc": [
              "3.1.1"
            ],
            "en301549": [
              "9.3.1.1"
            ]
          }
        },
        {
          "ruleId": "image-alt",
          "tags": [
            "cat.text-alternatives",
            "wcag2a",
            "wcag111",
            "section508",
            "section508.22.a",
            "TTv5",
            "TT7.a",
            "TT7.b",
            "EN-301-549",
            "EN-9.1.1.1",
            "ACT",
            "RGAAv4",
            "RGAA-1.1.1"
          ],
          "impact": "critical",
          "description": "Ensure <img> elements have alternative text or a role of none or presentation",
          "help": "Images must have alternative text",
          "helpUrl": "https://dequeuniversity.com/rules/axe/4.13/image-alt?application=playwright",
          "nodes": [
            {
              "target": [
                "img[src$=\"border_left_top.gif\"]"
              ],
              "html": "<img src=\"./img/border_left_top.gif\" width=\"10px\" height=\"10px\">",
              "failureSummary": "Fix any of the following:\n  Element does not have an alt attribute\n  aria-label attribute does not exist or is empty\n  aria-labelledby attribute does not exist, references elements that do not exist or references elements that are empty\n  Element has no title attribute\n  Element's default semantics were not overridden with role=\"none\" or role=\"presentation\""
            },
            {
              "target": [
                "img[src$=\"border_top.gif\"]"
              ],
              "html": "<img src=\"./img/border_top.gif\" height=\"10px\">",
              "failureSummary": "Fix any of the following:\n  Element does not have an alt attribute\n  aria-label attribute does not exist or is empty\n  aria-labelledby attribute does not exist, references elements that do not exist or references elements that are empty\n  Element has no title attribute\n  Element's default semantics were not overridden with role=\"none\" or role=\"presentation\""
            },
            {
              "target": [
                "img[src$=\"border_right_top.gif\"]"
              ],
              "html": "<img src=\"./img/border_right_top.gif\" width=\"10px\" height=\"10px\">",
              "failureSummary": "Fix any of the following:\n  Element does not have an alt attribute\n  aria-label attribute does not exist or is empty\n  aria-labelledby attribute does not exist, references elements that do not exist or references elements that are empty\n  Element has no title attribute\n  Element's default semantics were not overridden with role=\"none\" or role=\"presentation\""
            },
            {
              "target": [
                "img[src$=\"border_left.gif\"]"
              ],
              "html": "<img src=\"./img/border_left.gif\" width=\"10px\">",
              "failureSummary": "Fix any of the following:\n  Element does not have an alt attribute\n  aria-label attribute does not exist or is empty\n  aria-labelledby attribute does not exist, references elements that do not exist or references elements that are empty\n  Element has no title attribute\n  Element's default semantics were not overridden with role=\"none\" or role=\"presentation\""
            },
            {
              "target": [
                "img[src$=\"top_logo_next_end.gif\"]"
              ],
              "html": "<img src=\"./img/top_logo_next_end.gif\" width=\"24px\" height=\"86px\">",
              "failureSummary": "Fix any of the following:\n  Element does not have an alt attribute\n  aria-label attribute does not exist or is empty\n  aria-labelledby attribute does not exist, references elements that do not exist or references elements that are empty\n  Element has no title attribute\n  Element's default semantics were not overridden with role=\"none\" or role=\"presentation\""
            },
            {
              "target": [
                "img[src$=\"top_weather.gif\"]"
              ],
              "html": "<img src=\"./img/top_weather.gif\" width=\"128px\" height=\"86px\">",
              "failureSummary": "Fix any of the following:\n  Element does not have an alt attribute\n  aria-label attribute does not exist or is empty\n  aria-labelledby attribute does not exist, references elements that do not exist or references elements that are empty\n  Element has no title attribute\n  Element's default semantics were not overridden with role=\"none\" or role=\"presentation\""
            },
            {
              "target": [
                "img[src$=\"top_logo_next_start.gif\"]"
              ],
              "html": "<img src=\"./img/top_logo_next_start.gif\" width=\"22px\" height=\"86px\">",
              "failureSummary": "Fix any of the following:\n  Element does not have an alt attribute\n  aria-label attribute does not exist or is empty\n  aria-labelledby attribute does not exist, references elements that do not exist or references elements that are empty\n  Element has no title attribute\n  Element's default semantics were not overridden with role=\"none\" or role=\"presentation\""
            },
            {
              "target": [
                "img[src$=\"mark.gif\"]"
              ],
              "html": "<img src=\"./img/mark.gif\" width=\"158px\" height=\"7px\">",
              "failureSummary": "Fix any of the following:\n  Element does not have an alt attribute\n  aria-label attribute does not exist or is empty\n  aria-labelledby attribute does not exist, references elements that do not exist or references elements that are empty\n  Element has no title attribute\n  Element's default semantics were not overridden with role=\"none\" or role=\"presentation\""
            },
            {
              "target": [
                "td[colspan=\"5\"][background=\"./img/marker2_w.gif\"][width=\"780px\"] > img[src$=\"marker2_w.gif\"][width=\"78px\"][height=\"1px\"]"
              ],
              "html": "<img src=\".img/marker2_w.gif\" width=\"78px\" height=\"1px\">",